{"audit_chain_id":"audit.fixture","component_selection":["core"],"created_at":"2026-07-14T00:00:00Z","entrypoints":[{"entrypoint_id":"application","kind":"application","relative_path":"app/bin/tool.exe"}],"install_id":"install.fixture","last_verification":{"report_digest":"3333333333333333333333333333333333333333333333333333333333333333","report_id":"verify.fixture","status":"pass","verified_at":"2026-07-14T00:00:01Z"},"lifecycle_status":"installed","ownership_manifest_digest":"5087da6c9d0dcdf1d5a8d11dd2a988c6c70bb06e70b2407bdef106e36cc2edb3","ownership_manifest_ref":"ownership/install.fixture.json","product_id":"product.fixture","product_version":"1.2.3","recipe_digest":"1111111111111111111111111111111111111111111111111111111111111111","schema":"usk.installed_state.v1","setup_abi":{"major":1,"minor":0,"provider_revision":"fixture-provider-r1"},"source_archive_digest":"2222222222222222222222222222222222222222222222222222222222222222","target_root":"C:/fixture/portable","target_scope":"portable","transaction_id":"tx.fixture"}
